{
  "schema_version": "3.0",
  "corpus_id": "foundation-v4-future-activation-v3-authoring",
  "split": "authoring",
  "candidate_independent": true,
  "routing_surface": "fixed-four-adviser",
  "future_run_only": true,
  "no_replay_after_use": true,
  "reference_catalog": [
    "architecture-boundary",
    "decision-contract",
    "verification-evidence",
    "learning-adoption",
    "decomposition-boundary",
    "no-change-abstention",
    "reference-isolation"
  ],
  "structural_validation": [
    "AQ3 identifiers, families, nonces, and normalized prompts are unique across both splits",
    "automatic prompts contain no fixed-four adviser name",
    "explicit prompts contain exactly one backticked dollar-prefixed declared alias and no residual canonical adviser name",
    "expected and prohibited adviser labels partition the fixed four",
    "precedence labels agree with expected adviser cardinality",
    "reference expectations cover reference triggers exactly",
    "all cases are unconsumed and cannot be replayed after results"
  ],
  "cases": [
    {
      "id": "AQ3-A-001",
      "family_id": "aq3-queue-topology",
      "category": "decomposition",
      "mode": "automatic",
      "prompt": "A support queue needs retry, cancellation, and a human checkpoint. Recommend the smallest execution shape and explain what would justify a more complex one.",
      "authority": {
        "effect_authority": false,
        "claim_authority": false
      },
      "condition_blind": true,
      "labels_visible_to_runner": false,
      "outcomes_visible_to_authoring": false,
      "hidden_labels": {
        "expected_advisers": [
          "agentic-engineering"
        ],
        "must_not_select": [
          "codex-task-contract",
          "verification-strategy-engineering",
          "engineering-learning-loop"
        ],
        "reference_triggers": [
          "architecture-boundary"
        ],
        "reference_expectations": [
          {
            "trigger": "architecture-boundary",
            "reference_title": "architecture-decision-table",
            "required": true
          }
        ]
      },
      "precedence": {
        "rule": "single-owner",
        "primary_owner": "agentic-engineering",
        "competing_owner": null
      },
      "near_neighbor_kind": null,
      "declared_invocation": null,
      "anti_reuse": {
        "origin": "aq3-independent-future-corpus",
        "prior_prompt_content_reviewed": false,
        "case_nonce": "AQ3-A-001-queue-topology",
        "semantic_signature": [
          "support-queue",
          "retry",
          "cancellation",
          "human-checkpoint"
        ],
        "preuse_status": "unconsumed",
        "post_result_policy": "no-replay-create-new-future-holdout"
      }
    },
    {
      "id": "AQ3-A-002",
      "family_id": "aq3-recovery-state",
      "category": "decomposition",
      "mode": "automatic",
      "prompt": "An approval service can restart halfway through a request. Map the state, recovery boundary, and idempotency responsibilities before proposing implementation work.",
      "authority": {
        "effect_authority": false,
        "claim_authority": false
      },
      "condition_blind": true,
      "labels_visible_to_runner": false,
      "outcomes_visible_to_authoring": false,
      "hidden_labels": {
        "expected_advisers": [
          "agentic-engineering"
        ],
        "must_not_select": [
          "codex-task-contract",
          "verification-strategy-engineering",
          "engineering-learning-loop"
        ],
        "reference_triggers": [
          "architecture-boundary"
        ],
        "reference_expectations": [
          {
            "trigger": "architecture-boundary",
            "reference_title": "architecture-decision-table",
            "required": true
          }
        ]
      },
      "precedence": {
        "rule": "single-owner",
        "primary_owner": "agentic-engineering",
        "competing_owner": null
      },
      "near_neighbor_kind": null,
      "declared_invocation": null,
      "anti_reuse": {
        "origin": "aq3-independent-future-corpus",
        "prior_prompt_content_reviewed": false,
        "case_nonce": "AQ3-A-002-recovery-state",
        "semantic_signature": [
          "approval-service",
          "restart",
          "idempotency",
          "state-boundary"
        ],
        "preuse_status": "unconsumed",
        "post_result_policy": "no-replay-create-new-future-holdout"
      }
    },
    {
      "id": "AQ3-A-003",
      "family_id": "aq3-tool-permission-boundary",
      "category": "decomposition",
      "mode": "automatic",
      "prompt": "A research assistant may draft actions but must never send them. Design the ownership and permission boundary for drafting, approval, and execution.",
      "authority": {
        "effect_authority": false,
        "claim_authority": false
      },
      "condition_blind": true,
      "labels_visible_to_runner": false,
      "outcomes_visible_to_authoring": false,
      "hidden_labels": {
        "expected_advisers": [
          "agentic-engineering"
        ],
        "must_not_select": [
          "codex-task-contract",
          "verification-strategy-engineering",
          "engineering-learning-loop"
        ],
        "reference_triggers": [
          "architecture-boundary"
        ],
        "reference_expectations": [
          {
            "trigger": "architecture-boundary",
            "reference_title": "architecture-decision-table",
            "required": true
          }
        ]
      },
      "precedence": {
        "rule": "single-owner",
        "primary_owner": "agentic-engineering",
        "competing_owner": null
      },
      "near_neighbor_kind": null,
      "declared_invocation": null,
      "anti_reuse": {
        "origin": "aq3-independent-future-corpus",
        "prior_prompt_content_reviewed": false,
        "case_nonce": "AQ3-A-003-tool-permission-boundary",
        "semantic_signature": [
          "research-assistant",
          "drafting",
          "approval",
          "execution-boundary"
        ],
        "preuse_status": "unconsumed",
        "post_result_policy": "no-replay-create-new-future-holdout"
      }
    },
    {
      "id": "AQ3-A-004",
      "family_id": "aq3-workflow-escalation",
      "category": "decomposition",
      "mode": "automatic",
      "prompt": "A document intake process is currently sequential. Decide whether branching coordination is necessary, and name the evidence that would support escalation.",
      "authority": {
        "effect_authority": false,
        "claim_authority": false
      },
      "condition_blind": true,
      "labels_visible_to_runner": false,
      "outcomes_visible_to_authoring": false,
      "hidden_labels": {
        "expected_advisers": [
          "agentic-engineering"
        ],
        "must_not_select": [
          "codex-task-contract",
          "verification-strategy-engineering",
          "engineering-learning-loop"
        ],
        "reference_triggers": [],
        "reference_expectations": []
      },
      "precedence": {
        "rule": "single-owner",
        "primary_owner": "agentic-engineering",
        "competing_owner": null
      },
      "near_neighbor_kind": null,
      "declared_invocation": null,
      "anti_reuse": {
        "origin": "aq3-independent-future-corpus",
        "prior_prompt_content_reviewed": false,
        "case_nonce": "AQ3-A-004-workflow-escalation",
        "semantic_signature": [
          "document-intake",
          "sequential",
          "branching",
          "escalation-evidence"
        ],
        "preuse_status": "unconsumed",
        "post_result_policy": "no-replay-create-new-future-holdout"
      }
    },
    {
      "id": "AQ3-A-005",
      "family_id": "aq3-shared-state",
      "category": "decomposition",
      "mode": "automatic",
      "prompt": "Three independent specialists need a single source of task state while a coordinator can resume after failure. Propose the control architecture and recovery checkpoints.",
      "authority": {
        "effect_authority": false,
        "claim_authority": false
      },
      "condition_blind": true,
      "labels_visible_to_runner": false,
      "outcomes_visible_to_authoring": false,
      "hidden_labels": {
        "expected_advisers": [
          "agentic-engineering"
        ],
        "must_not_select": [
          "codex-task-contract",
          "verification-strategy-engineering",
          "engineering-learning-loop"
        ],
        "reference_triggers": [
          "architecture-boundary",
          "decomposition-boundary"
        ],
        "reference_expectations": [
          {
            "trigger": "architecture-boundary",
            "reference_title": "architecture-decision-table",
            "required": true
          },
          {
            "trigger": "decomposition-boundary",
            "reference_title": "seven-layer-diagnostic",
            "required": true
          }
        ]
      },
      "precedence": {
        "rule": "single-owner",
        "primary_owner": "agentic-engineering",
        "competing_owner": null
      },
      "near_neighbor_kind": null,
      "declared_invocation": null,
      "anti_reuse": {
        "origin": "aq3-independent-future-corpus",
        "prior_prompt_content_reviewed": false,
        "case_nonce": "AQ3-A-005-shared-state",
        "semantic_signature": [
          "specialists",
          "shared-state",
          "coordinator",
          "resume-checkpoint"
        ],
        "preuse_status": "unconsumed",
        "post_result_policy": "no-replay-create-new-future-holdout"
      }
    },
    {
      "id": "AQ3-A-006",
      "family_id": "aq3-control-placement",
      "category": "decomposition",
      "mode": "automatic",